Risk ID,Risk Title,Category,Description,Asset/Process,Threat,Vulnerability,Likelihood (1-5),Impact (1-5),Inherent Score,Existing Controls,Treatment Decision,Treatment Plan,Risk Owner,Residual Likelihood,Residual Impact,Residual Score,Status,Date Identified,Next Review
R-001,Phishing leads to credential theft,Access,Employees tricked into revealing credentials,Email/Identity,External attacker,Insufficient awareness/MFA,4,4,16,MFA on email; awareness training,Mitigate,Expand phishing-resistant MFA; quarterly simulations,CISO,2,4,8,Open,2025-01-15,2025-04-15
R-002,Unpatched internet-facing server,Vulnerability Mgmt,Critical vulnerability exploited remotely,Web servers,External attacker,Patching gaps,3,5,15,Monthly patching; vuln scanning,Mitigate,Reduce patch SLA for critical to 7 days,IT Operations,2,5,10,Open,2025-01-15,2025-04-15
R-003,Third-party data breach,Third Party,Vendor handling our data is breached,Vendor systems,Vendor compromise,Weak vendor security,3,4,12,Vendor due diligence; DPA in place,Transfer,Add breach notification and audit rights to contracts,Procurement,2,4,8,Open,2025-01-15,2025-07-15
R-004,Loss of data due to ransomware,Availability,Ransomware encrypts critical systems,File servers,Malware,Backup/segmentation gaps,3,5,15,EDR; offline backups,Mitigate,Test restores; improve segmentation,IT Operations,2,4,8,Open,2025-01-15,2025-04-15
R-005,Insider misuse of privileged access,Access,Privileged user misuses access,Critical systems,Malicious/negligent insider,Excess privileges; weak logging,2,5,10,Access reviews; logging,Mitigate,Implement PAM and just-in-time access,CISO,2,4,8,Open,2025-01-15,2025-04-15
R-006,Non-compliance with regulatory requirement,Compliance,Failure to meet a regulatory obligation,Compliance program,Regulatory change,Control gaps,2,4,8,Compliance monitoring,Mitigate,Map obligations and close gaps,Compliance,1,4,4,Open,2025-01-15,2025-07-15
R-007,Misconfigured cloud storage exposes data,Cloud,Public exposure of sensitive data,Cloud storage,External discovery,Misconfiguration,3,4,12,CSPM; IaC review,Mitigate,Enforce guardrails and automated checks,Cloud Team,1,4,4,Open,2025-01-15,2025-04-15
